{
    "schema_version": "1.0.0",
    "name": "buyer",
    "canvas": {
        "width": 380,
        "height": 560
    },
    "poses": ["seated"],
    "emotions": ["neutral", "concerned", "annoyed", "surprised", "confident", "pleased"],
    "gestures": {
        "idle": 30,
        "blink": 8,
        "nod": 32,
        "shake_head": 36,
        "raise_hand": 54,
        "shrug": 54,
        "show_phone": 120
    },
    "motion": {
        "blink_phase": 23,
        "blink_period": 137,
        "head_phase": 0,
        "body_phase": 0,
        "head_angles": {
            "concerned": -5,
            "confident": 3
        },
        "left_arm": {
            "shrug": -22,
            "raise_hand": -80
        },
        "right_arm": {
            "shrug": 22,
            "show_phone": 48
        }
    },
    "layers": [
        {
            "type": "group",
            "children": [
                {
                    "type": "ellipse",
                    "props": {
                        "cx": 190,
                        "cy": 535,
                        "rx": 140,
                        "ry": 25,
                        "fill": "#192832",
                        "opacity": 0.15,
                        "stroke": "none"
                    }
                },
                {
                    "type": "path",
                    "props": {
                        "d": "M100 375 Q100 480 120 530 L180 530 L190 455 L205 530 L268 530 Q295 470 275 375",
                        "fill": "#3c495c"
                    }
                },
                {
                    "type": "path",
                    "props": {
                        "d": "M82 220 Q190 170 296 220 L308 414 Q190 442 72 414Z",
                        "fill": "#da7b49"
                    }
                },
                {
                    "type": "path",
                    "props": {
                        "d": "M169 205 L170 166 L215 166 L220 205 Q196 229 169 205",
                        "fill": "#e4a77a"
                    }
                },
                {
                    "type": "path",
                    "props": {
                        "d": "M170 220 L190 250 L219 216 M190 250 L190 408",
                        "fill": "none",
                        "stroke": "#f6cc8a",
                        "strokeWidth": 5
                    }
                },
                {
                    "type": "group",
                    "children": [
                        {
                            "type": "path",
                            "props": {
                                "d": "M90 222 Q56 223 53 267 L43 346 Q47 373 82 367 L111 274",
                                "fill": "#da7b49"
                            }
                        },
                        {
                            "type": "ellipse",
                            "props": {
                                "cx": 62,
                                "cy": 365,
                                "rx": 24,
                                "ry": 31,
                                "fill": "#e4a77a"
                            }
                        }
                    ],
                    "motion": "left_arm",
                    "pivot": [87, 232]
                },
                {
                    "type": "group",
                    "children": [
                        {
                            "type": "path",
                            "props": {
                                "d": "M287 221 Q322 227 326 266 L337 344 Q330 372 298 364 L267 268",
                                "fill": "#da7b49"
                            }
                        },
                        {
                            "type": "ellipse",
                            "props": {
                                "cx": 317,
                                "cy": 359,
                                "rx": 24,
                                "ry": 31,
                                "fill": "#e4a77a"
                            }
                        },
                        {
                            "type": "group",
                            "children": [
                                {
                                    "type": "rect",
                                    "props": {
                                        "x": 0,
                                        "y": 0,
                                        "width": 58,
                                        "height": 108,
                                        "rx": 12,
                                        "fill": "#283446"
                                    }
                                },
                                {
                                    "type": "rect",
                                    "props": {
                                        "x": 7,
                                        "y": 12,
                                        "width": 44,
                                        "height": 78,
                                        "rx": 4,
                                        "fill": "#c9e5e2"
                                    }
                                },
                                {
                                    "type": "path",
                                    "props": {
                                        "d": "M17 32H41 M17 46H36 M17 60H41",
                                        "fill": "none",
                                        "stroke": "#609e9e",
                                        "strokeWidth": 4
                                    }
                                },
                                {
                                    "type": "circle",
                                    "props": {
                                        "cx": 29,
                                        "cy": 98,
                                        "r": 3,
                                        "fill": "#e8d5ad",
                                        "stroke": "none"
                                    }
                                }
                            ],
                            "props": {
                                "transform": "translate(297 305) rotate(-48)"
                            },
                            "when": {
                                "phone": true
                            }
                        }
                    ],
                    "motion": "right_arm",
                    "pivot": [289, 232]
                },
                {
                    "type": "group",
                    "children": [
                        {
                            "type": "path",
                            "props": {
                                "d": "M121 60 Q95 133 130 177 Q190 221 253 172 L263 88 Q212 25 121 60",
                                "fill": "#e4a77a"
                            }
                        },
                        {
                            "type": "ellipse",
                            "props": {
                                "cx": 114,
                                "cy": 130,
                                "rx": 13,
                                "ry": 20,
                                "fill": "#e4a77a"
                            }
                        },
                        {
                            "type": "ellipse",
                            "props": {
                                "cx": 266,
                                "cy": 130,
                                "rx": 12,
                                "ry": 20,
                                "fill": "#e4a77a"
                            }
                        },
                        {
                            "type": "path",
                            "props": {
                                "d": "M118 103 L111 69 Q107 18 174 29 Q225 8 259 57 L270 100 L247 83 L239 57 Q187 87 135 66 L132 101",
                                "fill": "#6a4035"
                            }
                        },
                        {
                            "type": "path",
                            "props": {
                                "d": "M143 98L171 98 M210 98L238 98",
                                "fill": "none",
                                "strokeWidth": 7
                            },
                            "when": {
                                "emotion": ["neutral"]
                            }
                        },
                        {
                            "type": "path",
                            "props": {
                                "d": "M143 103L171 93 M210 93L238 103",
                                "fill": "none",
                                "strokeWidth": 7
                            },
                            "when": {
                                "emotion": ["concerned"]
                            }
                        },
                        {
                            "type": "path",
                            "props": {
                                "d": "M143 92L171 104 M210 104L238 92",
                                "fill": "none",
                                "strokeWidth": 7
                            },
                            "when": {
                                "emotion": ["annoyed"]
                            }
                        },
                        {
                            "type": "path",
                            "props": {
                                "d": "M143 94L171 102 M210 102L238 94",
                                "fill": "none",
                                "strokeWidth": 7
                            },
                            "when": {
                                "emotion": ["surprised"]
                            }